{
  "change_id": "REST-001",
  "category": "rest_contract",
  "title": "Address postalCode field renamed to postcode",
  "query": "What breaks across repositories if the address JSON field postalCode is renamed to postcode in Account's address API?",
  "proposed_change": {
    "repo": "account-service",
    "diff": "-    String postalCode,\n+    String postcode,"
  },
  "ground_truth": {
    "affected_repositories": [
      { "name": "account-service", "criticality": "critical", "evidence_note": "owns Address records and address OpenAPI" },
      { "name": "commerce-bff", "criticality": "contract_consumer", "evidence_note": "forwards address request/response JSON between SPA and Account" },
      { "name": "order-service", "criticality": "critical", "evidence_note": "deserializes Address into immutable quote/order snapshot" },
      { "name": "shipment-service", "criticality": "contract_consumer", "evidence_note": "delivery-estimate rules read postalCode" },
      { "name": "commerce-web", "criticality": "contract_consumer", "evidence_note": "address form renders and submits postalCode" }
    ],
    "affected_symbols": [
      { "fqn": "com.poc.account.api.AddressResponse", "repo": "account-service", "kind": "record", "severity": "contract_consumer" },
      { "fqn": "com.poc.account.api.AddressRequest", "repo": "account-service", "kind": "record", "severity": "contract_consumer" },
      { "fqn": "com.poc.order.domain.AddressSnapshot", "repo": "order-service", "kind": "record", "severity": "contract_consumer" }
    ],
    "affected_contracts": [
      {
        "type": "rest",
        "identifier": "POST /api/v1/addresses",
        "provider_repo": "account-service",
        "consumer_repos": ["commerce-bff"],
        "severity": "contract_consumer"
      },
      {
        "type": "openapi",
        "identifier": "openapi:account.yaml#/components/schemas/AddressResponse",
        "provider_repo": "account-service",
        "consumer_repos": ["order-service", "shipment-service"],
        "severity": "contract_consumer"
      }
    ],
    "required_tests": [
      { "repo": "account-service", "suite": "AddressApiContractTest", "level": "contract" },
      { "repo": "order-service", "suite": "QuoteAddressSnapshotTest", "level": "unit" },
      { "repo": "commerce-platform", "suite": "SignupToConfirmedOrderIT", "level": "integration" }
    ],
    "known_incidents": []
  },
  "notes": "Fixture scenario row 1 of ecommerce-microservices-poc-design.md section 21. Order stores an immutable address snapshot at quote time, so Order breaks on deserialization even though it never mutates addresses."
}
